{
  "title": "Industrial Innovation Review",
  "subtitle": "Priorities for resilient, responsible growth",
  "recipient": "Programme steering committee",
  "author": "Programme Office",
  "date": "2026-08-22",
  "footer_style": "full",
  "contents": true,
  "confidentiality": "Internal working document"
}
