{
  "title": "Community Operations Review",
  "subtitle": "A practical plan for the next quarter",
  "recipient": "Kampong Social Club members",
  "author": "Community Operations",
  "date": "2026-08-19",
  "theme": "light",
  "footer_style": "full",
  "contents": true,
  "confidentiality": "Member information"
}
