{
  "title": "Agent Operations Review",
  "subtitle": "A reliable orchestration layer for the next quarter",
  "recipient": "Platform leadership",
  "author": "Lenno Operations",
  "date": "2026-08-19",
  "theme": "dark",
  "footer_style": "full",
  "contents": true,
  "confidentiality": "Internal planning"
}
